{"entries":[{"executable":false,"path":"a.txt","sha256":"ba7816bf8f01cfea414140de5dae2223b00361a396177a9cb410ff61f20015ad","size":3,"type":"file"},{"executable":true,"path":"bin/run","sha256":"e3b0c44298fc1c149afbf4c8996fb92427ae41e4649b934ca495991b7852b855","size":0,"type":"file"}],"executable_mode":"posix-mode","path_profile":"portable-v1","schema_version":"source-baseline-v1"}